{
  "schema": "ophiolite.polyline-set/1",
  "representation": "normalized",
  "source": {
    "authority": "ophiolite:uploaded",
    "key": "synthetic-faults",
    "revision": "937325c602a1a388ac2320f09e539a6b8d180d24ee12c29bd021c617543d9a04",
    "profile": "opendtect-faultsticks/1"
  },
  "source_sha256": "937325c602a1a388ac2320f09e539a6b8d180d24ee12c29bd021c617543d9a04",
  "interpretation": {
    "reader": "asset_connectors.typed_reader/1",
    "mapping": "polyline-set/1",
    "parsing_policy": "typed-strict/1",
    "null_policy": "empty cell or declared NODATA value is missing; never zero-filled"
  },
  "context": {
    "type": "polyline-set",
    "crs": "EPSG:23031",
    "xy_unit": "m",
    "z_unit": "m",
    "z_meaning": "depth",
    "positive": "down",
    "vertical_datum": "unknown",
    "attributes": [],
    "sticks": 2,
    "points": 4,
    "x_range": [
      500100.5,
      500310.0
    ],
    "y_range": [
      5800200.25,
      5800410.0
    ],
    "z_range": [
      1100.0,
      1350.0
    ],
    "fidelity": {
      "status": "assessed",
      "preserved": [
        "every stick in first-appearance order",
        "every point in file order",
        "stick indices as written",
        "geometry survives writing back as OpendTect FaultStickSet ASCII"
      ],
      "losses": [
        "Text formatting (whitespace, quoting, line endings, number spelling) is kept only in the exact original"
      ],
      "unknown_context": [
        "vertical_datum"
      ]
    }
  },
  "sticks": [
    {
      "index": 3,
      "points": [
        {
          "x": 500100.5,
          "y": 5800200.25,
          "z": 1200.0
        },
        {
          "x": 500110.0,
          "y": 5800210.0,
          "z": 1350.0
        }
      ]
    },
    {
      "index": 1,
      "points": [
        {
          "x": 500300.0,
          "y": 5800400.0,
          "z": 1100.0
        },
        {
          "x": 500310.0,
          "y": 5800410.0,
          "z": 1250.125
        }
      ]
    }
  ]
}
